{
  "schema_version": "1.1", "profile_id": "video_image_model", "version": "1.0.0", "description": "Reference and dialogue-image generation with per-image budget.", "kind": "model",
  "model": { "provider": "mock-provider", "model_id": "mock-image-model", "model_revision": "2026-07-24", "deployment_id": "demo-local", "region": "local", "runtime": "flowspec-mock", "modality": "vision", "selection_source": "explicit", "fallback_policy": "deny" },
  "budget": { "max_wall_seconds": 120, "max_media_units": { "image_count": 1 }, "max_cost": "0.50", "currency": "USD" },
  "data_policy": { "sensitivity": "sensitive", "external_transfer": "denied", "redaction_required": false, "residency": ["local"], "provider_retention": "denied", "provider_training": "denied", "purpose": "brand image generation", "deletion_policy_ref": "policy://creative-retention/v1" },
  "output": { "schema_ref": "schemas/artifacts.schema.json#/$defs/mediaMock", "validation": "strict", "max_repair_attempts": 0, "safety_policy_ref": "policy://brand-safety/v2", "moderation_required": true, "grounding_required": true, "evidence_required": false },
  "streaming": { "enabled": false, "partial_output_authoritative": false }
}
