{
  "schema_version": "1.1", "profile_id": "video_planning_model", "version": "1.0.0", "description": "Typed planning and visual-prompt model.", "kind": "model",
  "model": { "provider": "mock-provider", "model_id": "mock-planning-model", "model_revision": "2026-07-24", "deployment_id": "demo-local", "region": "local", "runtime": "flowspec-mock", "modality": "text", "selection_source": "explicit", "fallback_policy": "deny" },
  "budget": { "max_wall_seconds": 60, "max_input_tokens": 16000, "max_output_tokens": 4000, "max_cost": "0.20", "currency": "USD" },
  "data_policy": { "sensitivity": "sensitive", "external_transfer": "denied", "redaction_required": false, "residency": ["local"], "provider_retention": "denied", "provider_training": "denied", "purpose": "storyboard and visual prompt planning", "deletion_policy_ref": "policy://creative-retention/v1" },
  "output": { "schema_ref": "schemas/artifacts.schema.json", "validation": "strict", "max_repair_attempts": 1, "safety_policy_ref": "policy://brand-safety/v2", "moderation_required": true, "grounding_required": true, "evidence_required": false },
  "streaming": { "enabled": true, "partial_output_authoritative": false }
}
