{
  "schema_version": "1.1", "profile_id": "dd_financial_review", "version": "1.0.0", "description": "Grounded financial candidate review.", "kind": "model",
  "model": { "provider": "mock-provider", "model_id": "mock-financial-reviewer", "model_revision": "2026-07-24", "deployment_id": "demo-local", "region": "local", "runtime": "flowspec-mock", "modality": "text", "selection_source": "explicit", "fallback_policy": "deny" },
  "budget": { "max_wall_seconds": 120, "max_input_tokens": 26000, "max_output_tokens": 4000, "max_cost": "0.35", "currency": "USD" },
  "data_policy": { "sensitivity": "restricted", "external_transfer": "denied", "redaction_required": true, "residency": ["local"], "provider_retention": "denied", "provider_training": "denied", "purpose": "matter-scoped financial candidate review", "deletion_policy_ref": "policy://matter-retention/v1" },
  "output": { "schema_ref": "schemas/artifacts.schema.json#/$defs/findings", "validation": "strict", "max_repair_attempts": 1, "safety_policy_ref": "policy://dd-ai/v1", "moderation_required": false, "grounding_required": true, "evidence_required": true },
  "streaming": { "enabled": false, "partial_output_authoritative": false }
}
