{
  "schema_version": "1.1", "profile_id": "video_multimodal_qa", "version": "1.0.0", "description": "Candidate multimodal QA; publication still requires a human decision.", "kind": "model",
  "model": { "provider": "mock-provider", "model_id": "mock-multimodal-qa", "model_revision": "2026-07-24", "deployment_id": "demo-local", "region": "local", "runtime": "flowspec-mock", "modality": "multimodal", "selection_source": "explicit", "fallback_policy": "deny" },
  "budget": { "max_wall_seconds": 120, "max_input_tokens": 12000, "max_output_tokens": 2000, "max_media_units": { "video_seconds": 60 }, "max_cost": "0.40", "currency": "USD" },
  "data_policy": { "sensitivity": "sensitive", "external_transfer": "denied", "redaction_required": false, "residency": ["local"], "provider_retention": "denied", "provider_training": "denied", "purpose": "multimodal content QA", "deletion_policy_ref": "policy://creative-retention/v1" },
  "output": { "schema_ref": "schemas/artifacts.schema.json#/$defs/qa", "validation": "strict", "max_repair_attempts": 1, "safety_policy_ref": "policy://brand-safety/v2", "moderation_required": true, "grounding_required": true, "evidence_required": true },
  "streaming": { "enabled": false, "partial_output_authoritative": false }
}
